{
  "id": "form_invoice_example",
  "schemaVersion": "form-v1",
  "documentId": "doc_invoice_001",
  "templateId": "tpl_invoice_v2",
  "createdAt": 1780602754023,
  "updatedAt": 1780602754023,
  "sections": [
    {
      "id": "section_invoice_details",
      "title": "Invoice Details",
      "fieldIds": [
        "field_invoice_number",
        "field_invoice_total"
      ]
    },
    {
      "id": "section_assets",
      "title": "Codes and Assets",
      "fieldIds": [
        "field_invoice_qr"
      ]
    }
  ],
  "fields": [
    {
      "id": "field_invoice_number",
      "hypothesisId": "hyp_invoice_number",
      "label": "Invoice Number",
      "type": "id_number",
      "status": "confirmed",
      "value": "INV-1001",
      "displayValue": "INV-1001",
      "normalizedValue": "INV-1001",
      "required": true,
      "editable": true,
      "source": {
        "pageId": "page_1",
        "boxNorm": [
          0.7,
          0.14,
          0.88,
          0.17
        ],
        "sourceKind": "template_roi"
      },
      "evidenceIds": [
        "ev_roi_invoice_number",
        "ev_ocr_invoice_number"
      ],
      "validationIds": [
        "val_invoice_number_qr_match"
      ],
      "reasons": [
        "Extracted from matched template ROI",
        "QR payload cross-check passed"
      ],
      "ui": {
        "control": "text",
        "priority": "critical",
        "showInReviewQueue": false
      },
      "sensitivity": "sensitive"
    },
    {
      "id": "field_invoice_total",
      "hypothesisId": "hyp_invoice_total",
      "label": "Total",
      "type": "amount",
      "status": "conflict",
      "value": "1200.00",
      "displayValue": "\u20b91,200.00",
      "normalizedValue": {
        "amount": 1200,
        "currency": "INR"
      },
      "required": true,
      "editable": true,
      "source": {
        "pageId": "page_1",
        "boxNorm": [
          0.72,
          0.84,
          0.9,
          0.88
        ],
        "sourceKind": "ocr"
      },
      "evidenceIds": [
        "ev_ocr_total",
        "ev_table_total_calc"
      ],
      "validationIds": [
        "val_invoice_total_table_conflict"
      ],
      "reasons": [
        "Printed total does not match computed line-item total"
      ],
      "ui": {
        "control": "amount",
        "priority": "critical",
        "showInReviewQueue": true
      },
      "sensitivity": "sensitive"
    },
    {
      "id": "field_invoice_qr",
      "hypothesisId": "hyp_invoice_qr",
      "label": "QR Code",
      "type": "qr",
      "status": "confirmed",
      "value": {
        "payloadType": "invoice",
        "invoiceNumber": "INV-1001"
      },
      "displayValue": "Decoded invoice QR payload",
      "required": false,
      "editable": false,
      "source": {
        "pageId": "page_1",
        "boxNorm": [
          0.82,
          0.04,
          0.94,
          0.16
        ],
        "sourceKind": "barcode"
      },
      "evidenceIds": [
        "ev_qr_decode"
      ],
      "validationIds": [
        "val_invoice_number_qr_match"
      ],
      "reasons": [
        "QR code decoded locally"
      ],
      "ui": {
        "control": "code_payload",
        "priority": "normal",
        "showInReviewQueue": false
      },
      "sensitivity": "sensitive"
    }
  ],
  "reviewSummary": {
    "confirmed": 2,
    "needsReview": 0,
    "missing": 0,
    "conflict": 1,
    "invalid": 0,
    "unsupported": 0,
    "exportReady": false,
    "criticalUnresolved": 1
  }
}